{
  "id": "claim-cat-0001",
  "type": "claim",
  "label": "Litter-box distance affects in-box urination (n=1 cat)",
  "tier": "Dr",
  "created_at": "2026-09-04",
  "status": "ACTIVE",
  "ref": "records/claims/GLOSA-CC-20260904-0001.yaml",
  "standpoint": null,
  "superseded_by": null,
  "notes": ""
}
